problem,0,1,2,3
 The Bravofly Rumbo Website provides ----- data on its activities and technical assistance programs. , experienced          , detailed , plenty           , loyal 
 The position for a seasoned sales professional requires      --------- in the face of obstacles and a consistently positive attitude. , frequency         , participation  , abundance         , persistence  
 The company’s new sanitation regulations were ----- enacted to reflect changes in current industry standards. , overly           , promptly   , randomly           , assertively  
 Mr. Zimmerman was --------- by the CEO for resolving security issues that could have caused the company significant damage. , excelled           , realized  , commended           , apprised  
" Ms. Flores is -------- enough to work in a variety of assignments such as coordination of technical studies, customer relations research, and development of policy. ", complete        , delicate , versatile        , reliant 
 Mr. Bowie’s newest article was written after ------- researching the effects of economic inequality on higher education in America. , unbearably       , meticulously  , substantially       , potentially 
 The Khemlama Group strives to ------- customer concerns as quickly as possible in order to enhance customer satisfaction. , attend        , address   , notify        , stand  
